### ISSUE TITLE
Rootless support with Podman

### ISSUE THREAD

**Issue by rudstone** [m1k1o/neko#611]
I'll try to set up an _neko:chromium_ first instance with Podman rootless mode, but I have some errors when I try to do run my docker-compose. 

## Docker
docker-compose.yml
```yml
---
services:
  neko:
    image: ghcr.io/m1k1o/neko/chromium
    restart: unless-stopped
    container_name: neko
    shm_size: "2gb"
    cap_add:
      - SYS_ADMIN
    privileged: true
    ports:
      - 8080:8080
      - 52000-52100:52000-52100/udp
    environment:
      NEKO_DESKTOP_SCREEN: '1920x1080@30'
      NEKO_MEMBER_MULTIUSER_USER_PASSWORD: "neko"
      NEKO_MEMBER_MULTIUSER_ADMIN_PASSWORD: "admin"
      NEKO_WEBRTC_EPR: 52000-52100
      NEKO_WEBRTC_ICELITE: 1
      NEKO_WEBRTC_NAT1TO1: 9.8.7.6
```

## Output logs
```
podman compose logs -f
>>>> Executing external compose provider "/usr/bin/podman-compose". Please see podman-compose(1) for how to disable this message. <<<<

2026-01-05 14:17:51,256 INFO Included extra file "/etc/neko/supervisord/chromium.conf" during parsing
2026-01-05 14:17:51,256 INFO Set uid to user 0 succeeded
2026-01-05 14:17:51,258 INFO RPC interface 'supervisor' initialized
2026-01-05 14:17:51,258 CRIT Server 'unix_http_server' running without any HTTP authentication checking
2026-01-05 14:17:51,258 INFO supervisord started with pid 1
2026-01-05 14:17:52,263 INFO spawned: 'openbox' with pid 2
2026-01-05 14:17:52,265 INFO spawned: 'pulseaudio' with pid 3
2026-01-05 14:17:52,267 INFO spawned: 'x-server' with pid 4
2026-01-05 14:17:52,269 INFO spawned: 'chromium' with pid 5
2026-01-05 14:17:52,271 INFO spawned: 'neko' with pid 6
2026-01-05 14:17:52,275 DEBG 'pulseaudio' stdout output:
E: [pulseaudio] core-util.c: Failed to connect to system bus: Failed to connect to socket /run/dbus/system_bus_socket: No such file or directory
E: [pulseaudio] core-util.c: Failed to connect to system bus: Failed to connect to socket /run/dbus/system_bus_socket: No such file or directory
E: [pulseaudio] core-util.c: Failed to connect to system bus: Failed to connect to socket /run/dbus/system_bus_socket: No such file or directory
E: [pulseaudio] core-util.c: Failed to connect to system bus: Failed to connect to socket /run/dbus/system_bus_socket: No such file or directory
E: [pulseaudio] core-util.c: Failed to connect to system bus: Failed to connect to socket /run/dbus/system_bus_socket: No such file or directory
E: [pulseaudio] core-util.c: Failed to connect to system bus: Failed to connect to socket /run/dbus/system_bus_socket: No such file or directory

2026-01-05 14:17:52,275 DEBG 'pulseaudio' stdout output:
E: [pulseaudio] core-util.c: Failed to connect to system bus: Failed to connect to socket /run/dbus/system_bus_socket: No such file or directory
E: [pulseaudio] core-util.c: Failed to connect to system bus: Failed to connect to socket /run/dbus/system_bus_socket: No such file or directory
E: [pulseaudio] core-util.c: Failed to connect to system bus: Failed to connect to socket /run/dbus/system_bus_socket: No such file or directory
E: [pulseaudio] core-util.c: Failed to connect to system bus: Failed to connect to socket /run/dbus/system_bus_socket: No such file or directory
E: [pulseaudio] core-util.c: Failed to connect to system bus: Failed to connect to socket /run/dbus/system_bus_socket: No such file or directory

2026-01-05 14:17:52,279 DEBG 'x-server' stdout output:
_XSERVTransmkdir: Owner of /tmp/.X11-unix should be set to root

2026-01-05 14:17:52,281 DEBG 'pulseaudio' stdout output:
E: [null-sink] util.c: Failed to connect to system bus: Failed to connect to socket /run/dbus/system_bus_socket: No such file or directory
E: [null-sink] util.c: Failed to connect to system bus: Failed to connect to socket /run/dbus/system_bus_socket: No such file or directory

2026-01-05 14:17:52,281 DEBG 'pulseaudio' stdout output:
E: [null-sink] util.c: Failed to connect to system bus: Failed to connect to socket /run/dbus/system_bus_socket: No such file or directory
E: [null-sink] util.c: Failed to connect to system bus: Failed to connect to socket /run/dbus/system_bus_socket: No such file or directory
E: [null-sink] util.c: Failed to connect to system bus: Failed to connect to socket /run/dbus/system_bus_socket: No such file or directory

2026-01-05 14:17:52,282 DEBG 'pulseaudio' stdout output:
E: [null-sink] util.c: Failed to connect to system bus: Failed to connect to socket /run/dbus/system_bus_socket: No such file or directory
E: [null-sink] util.c: Failed to connect to system bus: Failed to connect to socket /run/dbus/system_bus_socket: No such file or directory
E: [null-sink] util.c: Failed to connect to system bus: Failed to connect to socket /run/dbus/system_bus_socket: No such file or directory
E: [null-sink] util.c: Failed to connect to system bus: Failed to connect to socket /run/dbus/system_bus_socket: No such file or directory
E: [null-sink] util.c: Failed to connect to system bus: Failed to connect to socket /run/dbus/system_bus_socket: No such file or directory

2026-01-05 14:17:52,282 DEBG 'x-server' stdout output:

X.Org X Server 1.20.11
X Protocol Version 11, Revision 0

2026-01-05 14:17:52,283 DEBG 'x-server' stdout output:
Build Operating System: linux Debian
Current Operating System: Linux a1e016e4bb1b 6.12.0-124.21.1.el10_1.x86_64 #1 SMP PREEMPT_DYNAMIC Mon Dec 22 05:10:57 EST 2025 x86_64
Kernel command line: BOOT_IMAGE=(hd0,gpt2)/vmlinuz-6.12.0-124.21.1.el10_1.x86_64 root=/dev/mapper/almalinux-root ro resume=UUID=6db38894-bfdc-4bed-b675-64d381b8e85e rd.lvm.lv=almalinux/root rd.lvm.lv=almalinux/swap crashkernel=2G-64G:256M,64G-:512M
Build Date: 19 October 2025  08:03:02PM
xorg-server 2:1.20.11-1+deb11u17 (https://www.debian.org/support) 
Current version of pixman: 0.40.0
	Before reporting problems, check http://wiki.x.org
	to make sure that you have the latest version.
Markers: (--) probed, (**) from config file, (==) default setting,
	(++) from command line, (!!) notice, (II) informational,
	(WW) warning, (EE) error, (NI) not implemented, (??) unknown.
(==) Log file: "/home/neko/.local/share/xorg/Xorg.99.0.log", Time: Mon Jan  5 14:17:52 2026
(++) Using config file: "/etc/neko/xorg.conf"
(==) Using system config directory "/usr/share/X11/xorg.conf.d"

2026-01-05 14:17:52,381 DEBG 'chromium' stdout output:
[5:79:0105/141752.381590:ERROR:dbus/bus.cc:408] Failed to connect to the bus: Failed to connect to socket /run/dbus/system_bus_socket: No such file or directory

2026-01-05 14:17:52,540 DEBG 'chromium' stdout output:
[5:125:0105/141752.540244:ERROR:dbus/bus.cc:408] Failed to connect to the bus: Failed to connect to socket /run/dbus/system_bus_socket: No such file or directory
[5:125:0105/141752.540295:ERROR:dbus/bus.cc:408] Failed to connect to the bus: Failed to connect to socket /run/dbus/system_bus_socket: No such file or directory

2026-01-05 14:17:52,544 DEBG 'chromium' stdout output:
[5:79:0105/141752.544408:ERROR:dbus/bus.cc:408] Failed to connect to the bus: Could not parse server address: Unknown address type (examples of valid types are "tcp" and on UNIX "unix")
[5:79:0105/141752.544436:ERROR:dbus/bus.cc:408] Failed to connect to the bus: Could not parse server address: Unknown address type (examples of valid types are "tcp" and on UNIX "unix")
[5:79:0105/141752.544445:ERROR:dbus/bus.cc:408] Failed to connect to the bus: Could not parse server address: Unknown address type (examples of valid types are "tcp" and on UNIX "unix")
[5:79:0105/141752.544451:ERROR:dbus/bus.cc:408] Failed to connect to the bus: Could not parse server address: Unknown address type (examples of valid types are "tcp" and on UNIX "unix")

2026-01-05 14:17:52,546 DEBG 'neko' stdout output:

    _   __     __
   / | / /__  / /______   \    /\
  /  |/ / _ \/ //_/ __ \   )  ( ')
 / /|  /  __/ ,< / /_/ /  (  /  )
/_/ |_/\___/_/|_|\____/    \(__)|
  nurdism/m1k1o server dev@dev

2026-01-05 14:17:52,546 DEBG 'neko' stdout output:
{"level":"info","time":"2026-01-05T14:17:52Z","message":"legacy configuration is enabled"}

2026-01-05 14:17:52,547 DEBG 'neko' stdout output:
2:17PM INF preflight complete with config file config=/etc/neko/neko.yaml log-dir= log-json=false log-level=info log-time=UNIX

2026-01-05 14:17:52,547 DEBG 'neko' stdout output:
2:17PM WRN no video pipelines specified, using default

2026-01-05 14:17:52,549 DEBG 'neko' stdout output:
2:17PM INF starting neko server service=neko

2026-01-05 14:17:52,550 DEBG 'neko' stdout output:
2:17PM INF setting initial screen size module=desktop screen_size=1920x1080@30

2026-01-05 14:17:52,551 DEBG 'neko' stdout output:
2:17PM INF syntax check for video stream pipeline passed module=capture pipeline="ximagesrc display-name=:99.0 show-pointer=true use-damage=false ! capsfilter caps=video/x-raw,framerate=2500/100 name=framerate ! videoconvert ! queue   ! vp8enc name=encoder cpu-used=4 threads=4 undershoot=95 buffer-initial-size=6144 keyframe-max-dist=25 min-quantizer=4 max-quantizer=20 target-bitrate=1996800 end-usage=cbr deadline=1 buffer-size=12288 buffer-optimal-size=9216  ! appsink name=appsink" video_id=legacy

2026-01-05 14:17:52,552 DEBG 'neko' stdout output:
2:17PM INF syntax check for video stream pipeline passed module=capture pipeline="ximagesrc display-name=:99.0 show-pointer=false use-damage=false ! capsfilter caps=video/x-raw,framerate=2500/100 name=framerate ! videoconvert ! queue   ! vp8enc name=encoder buffer-optimal-size=9216 cpu-used=4 threads=4 undershoot=95 buffer-initial-size=6144 keyframe-max-dist=25 min-quantizer=4 max-quantizer=20 target-bitrate=1996800 end-usage=cbr deadline=1 buffer-size=12288  ! appsink name=appsink" video_id=main

2026-01-05 14:17:52,552 DEBG 'neko' stdout output:
2:17PM INF starting module=webrtc submodule=cursor-image

2026-01-05 14:17:52,552 DEBG 'neko' stdout output:
2:17PM INF webrtc starting epr=52000-52100 icelite=true iceservers-backend=[{"urls":["stun:stun.l.google.com:19302"]}] iceservers-frontend=[{"urls":["stun:stun.l.google.com:19302"]}] icetrickle=true module=webrtc nat1to1=9.8.7.6 tcpmux=0 udpmux=0
2:17PM INF websocket starting module=websocket

2026-01-05 14:17:52,553 DEBG 'neko' stdout output:
2:17PM INF loading finished, total 0 plugins module=plugins

2026-01-05 14:17:52,553 DEBG 'neko' stdout output:
2:17PM INF plugin started module=plugins plugin=filetransfer
2:17PM INF plugin started module=plugins plugin=chat

2026-01-05 14:17:52,553 DEBG 'neko' stdout output:
2:17PM INF http listening on :8080 module=http
2:17PM INF neko ready service=neko

2026-01-05 14:17:52,561 DEBG 'chromium' stdout output:
[5:79:0105/141752.561765:ERROR:dbus/bus.cc:408] Failed to connect to the bus: Could not parse server address: Unknown address type (examples of valid types are "tcp" and on UNIX "unix")

2026-01-05 14:17:52,576 DEBG 'chromium' stdout output:
[5:79:0105/141752.576818:ERROR:dbus/bus.cc:408] Failed to connect to the bus: Could not parse server address: Unknown address type (examples of valid types are "tcp" and on UNIX "unix")

2026-01-05 14:17:52,624 DEBG 'chromium' stdout output:
[5:79:0105/141752.624410:ERROR:dbus/bus.cc:408] Failed to connect to the bus: Could not parse server address: Unknown address type (examples of valid types are "tcp" and on UNIX "unix")
[5:79:0105/141752.624434:ERROR:dbus/bus.cc:408] Failed to connect to the bus: Could not parse server address: Unknown address type (examples of valid types are "tcp" and on UNIX "unix")

2026-01-05 14:17:52,673 DEBG 'chromium' stdout output:
[5:5:0105/141752.673087:ERROR:dbus/object_proxy.cc:590] Failed to call method: org.freedesktop.DBus.NameHasOwner: object_path= /org/freedesktop/DBus: unknown error type: 

2026-01-05 14:17:52,677 DEBG 'chromium' stdout output:
[5:5:0105/141752.677030:ERROR:dbus/object_proxy.cc:590] Failed to call method: org.freedesktop.DBus.NameHasOwner: object_path= /org/freedesktop/DBus: unknown error type: 

2026-01-05 14:17:52,677 DEBG 'chromium' stdout output:
[5:79:0105/141752.677121:ERROR:dbus/bus.cc:408] Failed to connect to the bus: Could not parse server address: Unknown address type (examples of valid types are "tcp" and on UNIX "unix")

2026-01-05 14:17:52,677 DEBG 'chromium' stdout output:
[5:5:0105/141752.677681:ERROR:dbus/object_proxy.cc:590] Failed to call method: org.freedesktop.DBus.NameHasOwner: object_path= /org/freedesktop/DBus: unknown error type: 

2026-01-05 14:17:52,697 DEBG 'chromium' stdout output:
[5:196:0105/141752.697778:ERROR:dbus/bus.cc:408] Failed to connect to the bus: Failed to connect to socket /run/dbus/system_bus_socket: No such file or directory
[5:196:0105/141752.697821:ERROR:dbus/bus.cc:408] Failed to connect to the bus: Failed to connect to socket /run/dbus/system_bus_socket: No such file or directory

2026-01-05 14:17:52,698 DEBG 'chromium' stdout output:
[5:196:0105/141752.697970:ERROR:dbus/bus.cc:408] Failed to connect to the bus: Failed to connect to socket /run/dbus/system_bus_socket: No such file or directory
[5:196:0105/141752.698014:ERROR:dbus/bus.cc:408] Failed to connect to the bus: Failed to connect to socket /run/dbus/system_bus_socket: No such file or directory
[5:196:0105/141752.698063:ERROR:dbus/bus.cc:408] Failed to connect to the bus: Failed to connect to socket /run/dbus/system_bus_socket: No such file or directory

2026-01-05 14:17:52,698 DEBG 'chromium' stdout output:
[5:5:0105/141752.698679:ERROR:dbus/object_proxy.cc:590] Failed to call method: org.freedesktop.DBus.NameHasOwner: object_path= /org/freedesktop/DBus: unknown error type: 

2026-01-05 14:17:52,715 DEBG 'neko' stdout output:
2:17PM WRN X event error occured error_code=3 minor_code=0 module=desktop request_code=20

2026-01-05 14:17:52,715 DEBG 'neko' stdout output:
2:17PM WRN X event error occured error_code=3 minor_code=0 module=desktop request_code=20

2026-01-05 14:17:53,716 INFO success: openbox entered RUNNING state, process has stayed up for > than 1 seconds (startsecs)
2026-01-05 14:17:53,716 INFO success: pulseaudio entered RUNNING state, process has stayed up for > than 1 seconds (startsecs)
2026-01-05 14:17:53,717 INFO success: x-server entered RUNNING state, process has stayed up for > than 1 seconds (startsecs)
2026-01-05 14:17:53,717 INFO success: chromium entered RUNNING state, process has stayed up for > than 1 seconds (startsecs)
2026-01-05 14:17:53,717 INFO success: neko entered RUNNING state, process has stayed up for > than 1 seconds (startsecs)
2026-01-05 14:17:57,628 DEBG 'chromium' stdout output:
[5:80:0105/141757.628437:ERROR:google_apis/gcm/engine/registration_request.cc:291] Registration response error message: DEPRECATED_ENDPOINT

2026-01-05 14:17:57,629 DEBG 'chromium' stdout output:
[5:80:0105/141757.629156:ERROR:google_apis/gcm/engine/registration_request.cc:291] Registration response error message: PHONE_REGISTRATION_ERROR

2026-01-05 14:18:25,121 DEBG 'chromium' stdout output:
[5:80:0105/141825.120850:ERROR:google_apis/gcm/engine/registration_request.cc:291] Registration response error message: DEPRECATED_ENDPOINT
```

## Tests
- View listening ports `ss`
```sh
ss -tlpn
State       Recv-Q      Send-Q           Local Address:Port            Peer Address:Port      Process                                                                                       
LISTEN      0           128                    0.0.0.0:22                   0.0.0.0:*                                                                                                       
LISTEN      0           4096                         *:443                        *:*          users:(("traefik",pid=9460,fd=5),("conmon",pid=9458,fd=6),("aardvark-dns",pid=1724,fd=6))    
LISTEN      0           4096                         *:8443                       *:*          users:(("traefik",pid=9460,fd=7),("conmon",pid=9458,fd=8),("aardvark-dns",pid=1724,fd=8))    
LISTEN      0           128                       [::]:22                      [::]:*                                                                                                       
LISTEN      0           4096                         *:8082                       *:*          users:(("traefik",pid=9460,fd=3),("conmon",pid=9458,fd=4),("aardvark-dns",pid=1724,fd=4))    
LISTEN      0           4096                         *:8080                       *:*          users:(("rootlessport",pid=15573,fd=10))
```

- `tcpdump` capture flow on neko server (view **SYN** flag from my **laptop** to **neko** server):
```sh
tcpdump -nni any port 8080
tcpdump: data link type LINUX_SLL2
dropped privs to tcpdump
tcpdump: verbose output suppressed, use -v[v]... for full protocol decode
listening on any, link-type LINUX_SLL2 (Linux cooked v2), snapshot length 262144 bytes

15:20:12.049527 ens19 In  IP 1.2.3.4.40060 > 9.8.7.6.8080: Flags [S], seq 3369954386, win 64240, options [mss 1300,sackOK,TS val 3196472717 ecr 0,nop,wscale 10], length 0
15:20:12.109558 ens19 In  IP 1.2.3.4.47832 > 9.8.7.6.8080: Flags [S], seq 2568280504, win 64240, options [mss 1300,sackOK,TS val 3196472777 ecr 0,nop,wscale 10], length 0
15:20:12.109559 ens19 In  IP 1.2.3.4.47824 > 9.8.7.6.8080: Flags [S], seq 424082256, win 64240, options [mss 1300,sackOK,TS val 3196472777 ecr 0,nop,wscale 10], length 0
15:20:13.069198 ens19 In  IP 1.2.3.4.40060 > 9.8.7.6.8080: Flags [S], seq 3369954386, win 64240, options [mss 1300,sackOK,TS val 3196473737 ecr 0,nop,wscale 10], length 0
15:20:14.092855 ens19 In  IP 1.2.3.4.40060 > 9.8.7.6.8080: Flags [S], seq 3369954386, win 64240, options [mss 1300,sackOK,TS val 3196474761 ecr 0,nop,wscale 10], length 0
15:20:15.118044 ens19 In  IP 1.2.3.4.40060 > 9.8.7.6.8080: Flags [S], seq 3369954386, win 64240, options [mss 1300,sackOK,TS val 3196475786 ecr 0,nop,wscale 10], length 0
15:20:16.140723 ens19 In  IP 1.2.3.4.40060 > 9.8.7.6.8080: Flags [S], seq 3369954386, win 64240, options [mss 1300,sackOK,TS val 3196476809 ecr 0,nop,wscale 10], length 0
15:20:17.165710 ens19 In  IP 1.2.3.4.40060 > 9.8.7.6.8080: Flags [S], seq 3369954386, win 64240, options [mss 1300,sackOK,TS val 3196477833 ecr 0,nop,wscale 10], length 0
15:20:19.213792 ens19 In  IP 1.2.3.4.40060 > 9.8.7.6.8080: Flags [S], seq 3369954386, win 64240, options [mss 1300,sackOK,TS val 3196479881 ecr 0,nop,wscale 10], length 0
```
- WebUI
I try to access to: http://9.8.7.6:8080/ - Timeout error. I don't have any GPU in virtual machine with Podman, firewall OK.

Can you provide more help about this?
